{
  "schema_version": "tessera/makepad-component-manifest/v1",
  "component_count": 101,
  "category_counts": {
    "Base": 75,
    "Business": 11,
    "Charts": 15
  },
  "components": [
    {
      "id": "affix",
      "category": "Base",
      "kind": "composite",
      "strategy": "deferred",
      "status": "blocked",
      "source_ref": "design/02-base/07-other.md#Affix",
      "owner": {
        "product": "tessera-product",
        "ui": "design-owner",
        "engineering": "makepad-engineering",
        "test": "evidence-owner",
        "security": "security-owner"
      },
      "implementation": {
        "rust": "blocked:no Makepad production crate for affix (composite)",
        "gallery_route": "blocked:no Makepad gallery route for affix (composite)",
        "docs": "src/docs/AffixDoc.tsx",
        "theme_style": "design/01-foundations/07-interaction-states.md#affix",
        "structure_style": "design/02-base/07-other.md#Affix"
      },
      "case_ids": [],
      "evidence_refs": [],
      "constraints": [
        {
          "code": "MAKEPAD_PRODUCTION_PATH_MISSING",
          "reason": "The repository does not contain a Makepad production crate or sealed runtime evidence for this component.",
          "alternative": "Keep the component blocked until a native Makepad implementation, gallery route, and sealed evidence ledger are available.",
          "owner": "makepad-engineering",
          "deadline": "Before Makepad runtime verification"
        }
      ]
    },
    {
      "id": "alert",
      "category": "Base",
      "kind": "composite",
      "strategy": "deferred",
      "status": "blocked",
      "source_ref": "design/02-base/06-feedback.md#Alert",
      "owner": {
        "product": "tessera-product",
        "ui": "design-owner",
        "engineering": "makepad-engineering",
        "test": "evidence-owner",
        "security": "security-owner"
      },
      "implementation": {
        "rust": "blocked:no Makepad production crate for alert (composite)",
        "gallery_route": "blocked:no Makepad gallery route for alert (composite)",
        "docs": "src/docs/AlertDoc.tsx",
        "theme_style": "design/01-foundations/07-interaction-states.md#alert",
        "structure_style": "design/02-base/06-feedback.md#Alert"
      },
      "case_ids": [],
      "evidence_refs": [],
      "constraints": [
        {
          "code": "MAKEPAD_PRODUCTION_PATH_MISSING",
          "reason": "The repository does not contain a Makepad production crate or sealed runtime evidence for this component.",
          "alternative": "Keep the component blocked until a native Makepad implementation, gallery route, and sealed evidence ledger are available.",
          "owner": "makepad-engineering",
          "deadline": "Before Makepad runtime verification"
        }
      ]
    },
    {
      "id": "anchor",
      "category": "Base",
      "kind": "composite",
      "strategy": "deferred",
      "status": "blocked",
      "source_ref": "design/02-base/03-navigation.md#Anchor",
      "owner": {
        "product": "tessera-product",
        "ui": "design-owner",
        "engineering": "makepad-engineering",
        "test": "evidence-owner",
        "security": "security-owner"
      },
      "implementation": {
        "rust": "blocked:no Makepad production crate for anchor (composite)",
        "gallery_route": "blocked:no Makepad gallery route for anchor (composite)",
        "docs": "src/docs/AnchorDoc.tsx",
        "theme_style": "design/01-foundations/07-interaction-states.md#anchor",
        "structure_style": "design/02-base/03-navigation.md#Anchor"
      },
      "case_ids": [],
      "evidence_refs": [],
      "constraints": [
        {
          "code": "MAKEPAD_PRODUCTION_PATH_MISSING",
          "reason": "The repository does not contain a Makepad production crate or sealed runtime evidence for this component.",
          "alternative": "Keep the component blocked until a native Makepad implementation, gallery route, and sealed evidence ledger are available.",
          "owner": "makepad-engineering",
          "deadline": "Before Makepad runtime verification"
        }
      ]
    },
    {
      "id": "app",
      "category": "Base",
      "kind": "service",
      "strategy": "deferred",
      "status": "blocked",
      "source_ref": "design/02-base/07-other.md#App",
      "owner": {
        "product": "tessera-product",
        "ui": "design-owner",
        "engineering": "makepad-engineering",
        "test": "evidence-owner",
        "security": "security-owner"
      },
      "implementation": {
        "rust": "blocked:no Makepad production crate for app (service)",
        "gallery_route": "blocked:no Makepad gallery route for app (service)",
        "docs": "src/docs/AppDoc.tsx",
        "theme_style": "design/01-foundations/07-interaction-states.md#app",
        "structure_style": "design/02-base/07-other.md#App"
      },
      "case_ids": [],
      "evidence_refs": [],
      "constraints": [
        {
          "code": "MAKEPAD_PRODUCTION_PATH_MISSING",
          "reason": "The repository does not contain a Makepad production crate or sealed runtime evidence for this component.",
          "alternative": "Keep the component blocked until a native Makepad implementation, gallery route, and sealed evidence ledger are available.",
          "owner": "makepad-engineering",
          "deadline": "Before Makepad runtime verification"
        }
      ]
    },
    {
      "id": "auto-complete",
      "category": "Base",
      "kind": "composite",
      "strategy": "deferred",
      "status": "blocked",
      "source_ref": "design/02-base/04-data-entry.md#AutoComplete",
      "owner": {
        "product": "tessera-product",
        "ui": "design-owner",
        "engineering": "makepad-engineering",
        "test": "evidence-owner",
        "security": "security-owner"
      },
      "implementation": {
        "rust": "blocked:no Makepad production crate for auto-complete (composite)",
        "gallery_route": "blocked:no Makepad gallery route for auto-complete (composite)",
        "docs": "src/docs/AutoCompleteDoc.tsx",
        "theme_style": "design/01-foundations/07-interaction-states.md#auto-complete",
        "structure_style": "design/02-base/04-data-entry.md#AutoComplete"
      },
      "case_ids": [],
      "evidence_refs": [],
      "constraints": [
        {
          "code": "MAKEPAD_PRODUCTION_PATH_MISSING",
          "reason": "The repository does not contain a Makepad production crate or sealed runtime evidence for this component.",
          "alternative": "Keep the component blocked until a native Makepad implementation, gallery route, and sealed evidence ledger are available.",
          "owner": "makepad-engineering",
          "deadline": "Before Makepad runtime verification"
        }
      ]
    },
    {
      "id": "avatar",
      "category": "Base",
      "kind": "content",
      "strategy": "deferred",
      "status": "blocked",
      "source_ref": "design/02-base/05-data-display.md#Avatar",
      "owner": {
        "product": "tessera-product",
        "ui": "design-owner",
        "engineering": "makepad-engineering",
        "test": "evidence-owner",
        "security": "security-owner"
      },
      "implementation": {
        "rust": "blocked:no Makepad production crate for avatar (content)",
        "gallery_route": "blocked:no Makepad gallery route for avatar (content)",
        "docs": "src/docs/AvatarDoc.tsx",
        "theme_style": "design/01-foundations/07-interaction-states.md#avatar",
        "structure_style": "design/02-base/05-data-display.md#Avatar"
      },
      "case_ids": [],
      "evidence_refs": [],
      "constraints": [
        {
          "code": "MAKEPAD_PRODUCTION_PATH_MISSING",
          "reason": "The repository does not contain a Makepad production crate or sealed runtime evidence for this component.",
          "alternative": "Keep the component blocked until a native Makepad implementation, gallery route, and sealed evidence ledger are available.",
          "owner": "makepad-engineering",
          "deadline": "Before Makepad runtime verification"
        }
      ]
    },
    {
      "id": "badge",
      "category": "Base",
      "kind": "content",
      "strategy": "deferred",
      "status": "blocked",
      "source_ref": "design/02-base/05-data-display.md#Badge",
      "owner": {
        "product": "tessera-product",
        "ui": "design-owner",
        "engineering": "makepad-engineering",
        "test": "evidence-owner",
        "security": "security-owner"
      },
      "implementation": {
        "rust": "blocked:no Makepad production crate for badge (content)",
        "gallery_route": "blocked:no Makepad gallery route for badge (content)",
        "docs": "src/docs/BadgeDoc.tsx",
        "theme_style": "design/01-foundations/07-interaction-states.md#badge",
        "structure_style": "design/02-base/05-data-display.md#Badge"
      },
      "case_ids": [],
      "evidence_refs": [],
      "constraints": [
        {
          "code": "MAKEPAD_PRODUCTION_PATH_MISSING",
          "reason": "The repository does not contain a Makepad production crate or sealed runtime evidence for this component.",
          "alternative": "Keep the component blocked until a native Makepad implementation, gallery route, and sealed evidence ledger are available.",
          "owner": "makepad-engineering",
          "deadline": "Before Makepad runtime verification"
        }
      ]
    },
    {
      "id": "border-beam",
      "category": "Base",
      "kind": "primitive",
      "strategy": "deferred",
      "status": "blocked",
      "source_ref": "design/02-base/08-extensions.md#BorderBeam",
      "owner": {
        "product": "tessera-product",
        "ui": "design-owner",
        "engineering": "makepad-engineering",
        "test": "evidence-owner",
        "security": "security-owner"
      },
      "implementation": {